{
  "$schema": "https://agent-fox.dev/schemas/test_spec.v2.json",
  "spec_id": "02",
  "spec_name": "draft_feature",
  "schema_version": 2,
  "tests": [
    {
      "id": "TS-02-1",
      "kind": "unit",
      "verifies": [
        "02-REQ-1.1"
      ],
      "title": "A draft spec can be edited and saved",
      "given": [
        "a spec in the draft state"
      ],
      "when": "the PRD body is changed and Save is called",
      "then": [
        "Save returns no error",
        "the written prd.md carries the new body"
      ],
      "pseudocode": "s.PRDBody = new; assert s.Save(dir) == nil"
    },
    {
      "id": "TS-02-2",
      "kind": "unit",
      "verifies": [
        "02-REQ-1.2"
      ],
      "title": "An unknown lifecycle transition is rejected",
      "given": [
        "a spec in the draft state"
      ],
      "when": "Transition is called with a state outside the lifecycle graph",
      "then": [
        "a LifecycleError is returned",
        "the spec on disk is unchanged"
      ],
      "pseudocode": "_, err = s.Transition('bogus', dir); assert err != nil"
    },
    {
      "id": "TS-02-3",
      "kind": "smoke",
      "verifies": [
        "02-PATH-1"
      ],
      "title": "An operator edits a draft spec end to end",
      "given": [
        "a draft spec directory on disk"
      ],
      "when": "the Intent section is edited and the spec is saved and reloaded",
      "then": [
        "the reloaded body carries the edit",
        "intent_hash is still null"
      ],
      "real_components": [
        "afspec library",
        "spec directory on disk"
      ]
    }
  ]
}
